Authors	Publication Date	Publisher	Description	Citations
Zetao Chen, Stephanie Lowry, Adam Jacobson, Zongyuan Ge, Michael Milford	2015/9/28	None	Abstract: The recent focus on performing visual navigation and place recognition in changing environments has resulted in a large number of heterogeneous techniques each utilizing their own learnt or hand crafted visual features. This paper presents a generally applicable method for learning the appropriate distance metric by which to compare feature responses from any of these techniques in order to perform place recognition under changing environmental conditions. We implement an approach which learns to cluster  ...	2
William Chamberlain, Tom Drummond, Peter Corke	2015/12	None	Abstract: Robotic vision is limited by line of sight and on-board camera capabilities. Robots can acquire video or images from remote cameras, but processing additional data has a computational burden. This paper applies the Distributed Robotic Vision Service, DRVS, to robot path planning using data outside line-of-sight of the robot. DRVS implements a distributed visual object detection service to distributes the computation to remote camera nodes with processing capabilities. Robots request task-specific object detection from  ...	1
Buyu Liu, Xuming He, Stephen Gould	2015/1/5	None	Abstract: We tackle the problem of semantic segmentation of dynamic scene in video sequences. We propose to incorporate foreground object information into pixel labeling by jointly reasoning semantic labels of super-voxels, object instance tracks and geometric relations between objects. We take an exemplar approach to object modeling by using a small set of object annotations and exploring the temporal consistency of object motion. After generating a set of moving object hypotheses, we design a CRF framework that jointly  ...	9
Alex Bewley, Ben Upcroft	2016	None	Abstract This paper presents visual detection and classification of light vehicles and personnel on a mine site. We capitalise on the rapid advances of ConvNet based object recognition but highlight that a naive black box approach results in a significant number of false positives. In particular, the lack of domain specific training data and the unique landscape in a mine site causes a high rate of errors. We exploit the abundance of background-only images to train a k-means classifier to complement the ConvNet.  ...	3
Thalaiyasingam Ajanthan, Richard Hartley, Mathieu Salzmann, Hongdong Li	2015/6	None	Abstract While widely acknowledged as highly effective in computer vision, multi-label MRFs with non-convex priors are difficult to optimize. To tackle this, we introduce an algorithm that iteratively approximates the original energy with an appropriately weighted surrogate energy that is easier to minimize. Our algorithm guarantees that the original energy decreases at each iteration. In particular, we consider the scenario where the global minimizer of the weighted surrogate energy can be obtained by a multi-label graph cut algorithm, and  ...	5
Khurrum Aftab, Richard Hartley	2015/9/27	None	Abstract: In this paper we propose a method to solve for an L q solution of bundle adjustment, a non-linear parameter estimation problem. Given a set of images of a scene, bundle adjustment simultaneously estimates camera parameters and 3D structure of the scene. Generally, a least squares criterion is minimized by using the Levenberg-Marquardt (LM) method, a non-linear least squares optimization method. It is known that the least squares methods are not robust to outliers, even a single outlier can deviate the solution  ...	2
Khurrum Aftab, Richard Hartley	2015/1/5	None	Abstract: This paper presents a way of using the Iteratively Reweighted Least Squares (IRLS) method to minimize several robust cost functions such as the Huber function, the Cauchy function and others. It is known that IRLS (otherwise known as Weiszfeld) techniques are generally more robust to outliers than the corresponding least squares methods, but the full range of robust M-estimators that are amenable to IRLS has not been investigated. In this paper we address this question and show that IRLS methods can be  ...	11
Zetao Chen, Jones Yuen, Ross Crawford, Jiang Chang, Chengtie Wu, Yin Xiao	2015/8/31	None	Abstract Osteoblast lineage cells are direct effectors of osteogenesis and are, therefore, commonly used to evaluate the in vitro osteogenic capacity of bone substitute materials. This method has served its purposes when testing novel bone biomaterials; however, inconsistent results between in vitro and in vivo studies suggest the mechanisms that govern a material's capacity to mediate osteogenesis are not well understood. The emerging field of osteoimmunology and immunomodulation has informed a paradigm shift in our view of  ...	29
Michael Warren, Luis Mejias, Jonathan Kok, Xilin Yang, Felipe Gonzalez, Ben Upcroft	2015/12	None	Abstract A number of hurdles must be overcome in order to integrate unmanned aircraft into civilian airspace for routine operations. The ability of the aircraft to land safely in an emergency is essential to reduce the risk to people, infrastructure, and aircraft. To date, few field-demonstrated systems have been presented that show online replanning and repeatability from failure to touchdown. This paper presents the development of the guidance, navigation, and control (GNC) component of an automated emergency landing  ...	2
Xiaoqin Wang, Yasar Ahmet Şekercioğlu, Tom Drummond, Enrico Natalizio, Isabelle Fantoni, Vincent Frémont	2016/4	None	Abstract: We propose a new method, called 3-D image warping-based depth video compression (IW-DVC), for fast and efficient compression of depth images captured by mobile RGB-D sensors. The emergence of low-cost RGB-D sensors has created opportunities to find new solutions for a number of computer vision and networked robotics problems, such as 3-D map building, immersive telepresence, or remote sensing. However, efficient transmission and storage of depth data still presents a challenging task to the  ...	0
Xiaoqin Wang, Y Ahmet Şekercioğlu, Tom Drummond	2014/12/26	None	Abstract: We present a new vision based cooperative pose estimation scheme for systems of mobile robots equipped with RGB-D cameras. We first model a multi-robot system as an edge-weighted graph. Then, based on this model, and by using the real-time color and depth data, the robots with shared field-of-views estimate their relative poses in pairwise. The system does not need the existence of a single common view shared by all robots, and it works in 3D scenes without any specific calibration pattern or landmark. The proposed  ...	6
Qinfeng Shi, Mark Reid, Tiberio Caetano, Anton Van den Hengel, Zhenhua Wang	2015/1	None	Abstract: We propose a novel hybrid loss for multiclass and structured prediction problems that is a convex combination of a log loss for Conditional Random Fields (CRFs) and a multiclass hinge loss for Support Vector Machines (SVMs). We provide a sufficient condition for when the hybrid loss is Fisher consistent for classification. This condition depends on a measure of dominance between labels-specifically, the gap between the probabilities of the best label and the second best label. We also prove Fisher consistency is necessary for  ...	5
Inkyu Sa, Stefan Hrabar, Peter Corke	2015	None	Abstract We present a pole inspection system for outdoor environments comprising a high-speed camera on a vertical take-off and landing (VTOL) aerial platform. The pole inspection task requires a vehicle to fly close to a structure while maintaining a fixed stand-off distance from it. Typical GPS errors make GPS-based navigation unsuitable for this task however. When flying outdoors a vehicle is also affected by aerodynamics disturbances such as wind gusts, so the onboard controller must be robust to these disturbances in order to maintain  ...	13
David Ryan, Simon Denman, Sridha Sridharan, Clinton Fookes	2015/1/31	None	Abstract Existing crowd counting algorithms rely on holistic, local or histogram based features to capture crowd properties. Regression is then employed to estimate the crowd size. Insufficient testing across multiple datasets has made it difficult to compare and contrast different methodologies. This paper presents an evaluation across multiple datasets to compare holistic, local and histogram based methods, and to compare various image features and regression models. A K-fold cross validation protocol is followed to evaluate  ...	37
Peer Neubert, Niko Sunderhauf, Peter Protzel	2013/9/25	None	Abstract: Changing environments pose a serious problem to current robotic systems aiming at long term operation. While place recognition systems perform reasonably well in static or low-dynamic environments, severe appearance changes that occur between day and night, between different seasons or different local weather conditions remain a challenge. In this paper we propose to learn to predict the changes in an environment. Our key insight is that the occurring appearance changes are in part systematic, repeatable and therefore  ...	56
Miaomiao Liu, Richard Hartley, Mathieu Salzmann	2015/4/1	None	Abstract This paper tackles the problem of reconstructing the shape of a smooth mirror surface from a single image. In particular, we consider the case where the camera is observing the reflection of a static reference target in the unknown mirror. We first study the reconstruction problem given dense correspondences between 3D points on the reference target and image locations. In such conditions, our differential geometry analysis provides a theoretical proof that the shape of the mirror surface can be uniquely recovered if the pose  ...	28
Stephanie Lowry, Niko Sunderhauf, Paul Newman, John J Leonard, David Cox, Peter Corke, Michael J Milford	2016	None	Abstract: Visual place recognition is a challenging problem due to the vast range of ways in which the appearance of real-world places can vary. In recent years, improvements in visual sensing capabilities, an ever-increasing focus on long-term mobile robot autonomy, and the ability to draw on state-of-the-art research in other disciplines-particularly recognition in computer vision and animal navigation in neuroscience-have all contributed to significant advances in visual place recognition systems. This paper presents a survey of the visual  ...	55
Fayao Liu, Guosheng Lin, Chunhua Shen	2015/10/31	None	Abstract Conditional Random Rields (CRF) have been widely applied in image segmentations. While most studies rely on hand-crafted features, we here propose to exploit a pre-trained large convolutional neural network (CNN) to generate deep features for CRF learning. The deep CNN is trained on the ImageNet dataset and transferred to image segmentations here for constructing potentials of superpixels. Then the CRF parameters are learnt using a structured support vector machine (SSVM). To fully exploit context  ...	36
Xi Li, Chunhua Shen, Anthony Dick, Zhongfei Mark Zhang, Yueting Zhuang	2016/5/1	None	Abstract: In this paper, we propose a visual tracker based on a metric-weighted linear representation of appearance. In order to capture the interdependence of different feature dimensions, we develop two online distance metric learning methods using proximity comparison information and structured output learning. The learned metric is then incorporated into a linear representation of appearance. We show that online distance metric learning significantly improves the robustness of the tracker, especially on those  ...	10
Jingxin Xu, Simon Denman, Sridha Sridharan, Clinton Fookes	2015/6	None	Abstract: Due to the popularity of security cameras in public places, it is of interest to design an intelligent system that can efficiently detect events automatically. This paper proposes a novel algorithm for multiperson event detection. To ensure greater than real-time performance, features are extracted directly from compressed MPEG video. A novel histogram-based feature descriptor that captures the angles between extracted particle trajectories is proposed, which allows us to capture motion patterns for multiperson events  ...	7
Adam Jacobson, Zetao Chen, Michael Milford	2015/1/1	None	Abstract The vast majority of current robot mapping and navigation systems require specific well-characterized sensors that may require human-supervised calibration and are applicable only in one type of environment. Furthermore, if a sensor degrades in performance, either through damage to itself or changes in environmental conditions, the effect on the mapping system is usually catastrophic. In contrast, the natural world presents robust, reasonably well-characterized solutions to these problems. Using simple  ...	8
Hui Li, Chunhua Shen, Anton van den Hengel, Qinfeng Shi	2015/8	None	Abstract: In this paper, we propose an efficient semidefinite programming (SDP) approach to worst case linear discriminant analysis (WLDA). Compared with the traditional LDA, WLDA considers the dimensionality reduction problem from the worst case viewpoint, which is in general more robust for classification. However, the original problem of WLDA is non-convex and difficult to optimize. In this paper, we reformulate the optimization problem of WLDA into a sequence of semidefinite feasibility problems. To efficiently solve the semidefinite  ...	4
Basura Fernando, Tatiana Tommasi, Tinne Tuytelaars	2015/11/1	None	Abstract Domain adaptation aims at adapting the knowledge acquired on a source domain to a new different but related target domain. Several approaches have been proposed for classification tasks in the unsupervised scenario, where no labeled target data are available. Most of the attention has been dedicated to searching a new domain-invariant representation, leaving the definition of the prediction function to a second stage. Here we propose to learn both jointly. Specifically we learn the source subspace that best matches  ...	12
Chamira US Edussooriya, Donald G Dansereau, Len T Bruton, Panajotis Agathoklis	2015/4/15	None	Abstract Five-dimensional (5-D) light field video (LFV)(also known as plenoptic video) is a more powerful form of representing information of dynamic scenes compared to conventional three-dimensional (3-D) video. In this paper, the 5-D spectrum of an object in an LFV is derived for the important practical case of objects moving with constant velocity and at constant depth. In particular, it is shown that the region of support (ROS) of the 5-D spectrum is a skewed 3-D hyperfan in the 5-D frequency domain, with the degree of skew  ...	13
Donald G Dansereau, Oscar Pizarro, Stefan B Williams	2015/2/1	None	We demonstrate that the redundant information in light field imagery allows volumetric focus, an improvement of signal quality that maintains focus over a controllable range of depths. To do this, we derive the frequencydomain region of support of the light field, finding it to be the 4D hyperfan at the intersection of a dual fan and a hypercone, and design a filter with correspondingly shaped passband. Drawing examples from the Stanford Light Field Archive and images captured using a commercially available lenslet-based plenoptic camera, we  ...	29
Anoop Cherian, Vassilios Morellas, Nikos Papanikolopoulos	2015/5	None	Abstract: Symmetric Positive Definite (SPD) matrices emerge as data descriptors in several applications of computer vision such as object tracking, texture recognition, and diffusion tensor imaging. Clustering these data matrices forms an integral part of these applications, for which soft-clustering algorithms (K-Means, expectation maximization, etc.) are generally used. As is well-known, these algorithms need the number of clusters to be specified, which is difficult when the dataset scales. To address this issue, we resort to the classical  ...	3
Zetao Chen, Stephanie Lowry, Adam Jacobson, Michael E Hasselmo, Michael Milford	2015/12/31	None	Abstract Robotic mapping and localization systems typically operate at either one fixed spatial scale, or over two, combining a local metric map and a global topological map. In contrast, recent high profile discoveries in neuroscience have indicated that animals such as rodents navigate the world using multiple parallel maps, with each map encoding the world at a specific spatial scale. While a number of theoretical-only investigations have hypothesized several possible benefits of such a multi-scale mapping system, no one has  ...	6
Jonathan Andersh, Anoop Cherian, Bérénice Mettler, Nikolaos Papanikolopoulos	2015/8/1	None	Abstract Successful operation of a miniature rotorcraft relies on capabilities including automated guidance, trajectory following, and teleoperation; all of which require accurate estimates of the vehicle's body velocities and Euler angles. For larger rotorcraft that operate outdoors, the traditional approach is to combine a highly accurate IMU with GPS measurements. However, for small scale rotorcraft that operate indoors, lower quality MEMS IMUs are used because of limited payload. In indoor applications GPS is usually not  ...	1
Khurrum Aftab, Richard Hartley, Jochen Trumpf	None	None	None	13
J. Leitner	2015/10/6	None	In recent years more and more complex humanoid robots have been developed. On the other hand programming these systems has become more difficult. There is a clear need for such robots to be able to adapt and perform certain tasks autonomously, or even learn by themselves how to act. An important issue to tackle is the closing of the sensorimotor loop. Especially when talking about humanoids the tight integration of perception with actions will allow for improved behaviours, embedding adaptation on the lower-level of the system.	1
